{"$schema":"https://json-schema.org/draft/2020-12/schema","type":"object","required":["schema_version","generated_at","total_apps","total_cves_considered","app_scores","permission_vuln_edges"],"properties":{"schema_version":{"const":"1.0"},"generated_at":{"type":"string"},"total_apps":{"type":"integer"},"total_cves_considered":{"type":"integer"},"app_scores":{"type":"array","items":{"type":"object","required":["app_id","app_name","category","clri","rank","top_risk_permissions","top_associated_cves","component_breakdown"]}},"permission_vuln_edges":{"type":"array","items":{"type":"object","required":["source","target","weight","rho"]}}}}
