{
  "schema_version": "1.0",
  "generated_at": "2026-06-11T16:00:37.161651+00:00",
  "total_apps": 3,
  "total_cves_considered": 3,
  "app_scores": [
    {
      "app_id": "com.mso.media",
      "app_name": "MSO Media",
      "category": "Multimedia",
      "clri": 7.17,
      "rank": 1,
      "top_risk_permissions": [
        {
          "permission": "android.permission.RECORD_AUDIO",
          "contribution": 3.4
        },
        {
          "permission": "android.permission.READ_MEDIA_VIDEO",
          "contribution": 2.6
        },
        {
          "permission": "android.permission.CAMERA",
          "contribution": 1.07
        },
        {
          "permission": "android.permission.INTERNET",
          "contribution": 0.1
        }
      ],
      "top_associated_cves": [
        {
          "cve_id": "CVE-2024-1101",
          "rho": 1.0,
          "severity": "Critical",
          "component_category": "Media",
          "contribution": 7.07
        },
        {
          "cve_id": "CVE-2024-1001",
          "rho": 0.2,
          "severity": "High",
          "component_category": "Framework",
          "contribution": 0.06
        },
        {
          "cve_id": "CVE-2025-3001",
          "rho": 0.2,
          "severity": "Moderate",
          "component_category": "Vendor",
          "contribution": 0.04
        }
      ],
      "component_breakdown": {
        "Framework": 0.06,
        "Media": 7.07,
        "Vendor": 0.04
      }
    },
    {
      "app_id": "org.mso.demo",
      "app_name": "MSO Demo",
      "category": "Development",
      "clri": 2.52,
      "rank": 2,
      "top_risk_permissions": [
        {
          "permission": "android.permission.ACCESS_FINE_LOCATION",
          "contribution": 1.35
        },
        {
          "permission": "android.permission.CAMERA",
          "contribution": 1.07
        },
        {
          "permission": "android.permission.INTERNET",
          "contribution": 0.1
        }
      ],
      "top_associated_cves": [
        {
          "cve_id": "CVE-2024-1001",
          "rho": 0.5,
          "severity": "High",
          "component_category": "Framework",
          "contribution": 1.41
        },
        {
          "cve_id": "CVE-2024-1101",
          "rho": 0.3333,
          "severity": "Critical",
          "component_category": "Media",
          "contribution": 1.07
        },
        {
          "cve_id": "CVE-2025-3001",
          "rho": 0.2,
          "severity": "Moderate",
          "component_category": "Vendor",
          "contribution": 0.04
        }
      ],
      "component_breakdown": {
        "Framework": 1.41,
        "Media": 1.07,
        "Vendor": 0.04
      }
    },
    {
      "app_id": "io.mso.reader",
      "app_name": "MSO Reader",
      "category": "Reading",
      "clri": 0.85,
      "rank": 3,
      "top_risk_permissions": [
        {
          "permission": "android.permission.READ_CONTACTS",
          "contribution": 0.75
        },
        {
          "permission": "android.permission.INTERNET",
          "contribution": 0.1
        }
      ],
      "top_associated_cves": [
        {
          "cve_id": "CVE-2024-1001",
          "rho": 0.3333,
          "severity": "High",
          "component_category": "Framework",
          "contribution": 0.81
        },
        {
          "cve_id": "CVE-2025-3001",
          "rho": 0.2,
          "severity": "Moderate",
          "component_category": "Vendor",
          "contribution": 0.04
        }
      ],
      "component_breakdown": {
        "Framework": 0.81,
        "Vendor": 0.04
      }
    }
  ],
  "permission_vuln_edges": [
    {
      "source": "android.permission.READ_MEDIA_VIDEO",
      "target": "CVE-2024-1101",
      "weight": 4.0,
      "rho": 1.0
    },
    {
      "source": "android.permission.RECORD_AUDIO",
      "target": "CVE-2024-1101",
      "weight": 4.0,
      "rho": 1.0
    },
    {
      "source": "android.permission.ACCESS_FINE_LOCATION",
      "target": "CVE-2024-1001",
      "weight": 1.5,
      "rho": 0.5
    },
    {
      "source": "android.permission.CAMERA",
      "target": "CVE-2024-1101",
      "weight": 1.3333,
      "rho": 0.3333
    },
    {
      "source": "android.permission.READ_CONTACTS",
      "target": "CVE-2024-1001",
      "weight": 1.0,
      "rho": 0.3333
    },
    {
      "source": "android.permission.INTERNET",
      "target": "CVE-2024-1001",
      "weight": 0.6,
      "rho": 0.2
    },
    {
      "source": "android.permission.INTERNET",
      "target": "CVE-2025-3001",
      "weight": 0.4,
      "rho": 0.2
    }
  ]
}
